{
  "$schema": "https://json-schema.org/draft/2020-12/schema",
  "$id": "https://gitgammon.github.io/schemas/move.json",
  "title": "GitGammon Move File",
  "description": "Individual move submission for a GitGammon table",
  "type": "object",
  "required": [
    "player",
    "moves",
    "timestamp",
    "expectedState",
    "diceRoll",
    "comment",
    "commitSha"
  ],
  "properties": {
    "player": {
      "type": "string",
      "enum": ["white", "black"],
      "description": "Player making the move"
    },
    "moves": {
      "type": "array",
      "items": {
        "$ref": "#/$defs/SingleMove"
      },
      "minItems": 1,
      "maxItems": 4,
      "description": "Array of individual moves (1-4 moves per turn)"
    },
    "timestamp": {
      "type": "string",
      "format": "date-time",
      "description": "ISO 8601 timestamp when move was submitted"
    },
    "expectedState": {
      "type": "string",
      "pattern": "^[a-f0-9]{16}$",
      "description": "Truncated SHA-256 hash of state.json before move (16 characters)"
    },
    "diceRoll": {
      "type": "array",
      "items": {
        "type": "integer",
        "minimum": 1,
        "maximum": 6
      },
      "minItems": 2,
      "maxItems": 4,
      "description": "Dice values being used (2 for normal, 4 for doubles)"
    },
    "comment": {
      "oneOf": [
        { "type": "null" },
        {
          "type": "string",
          "maxLength": 280
        }
      ],
      "description": "Optional player comment or message"
    },
    "commitSha": {
      "oneOf": [
        { "type": "null" },
        {
          "type": "string",
          "pattern": "^[a-f0-9]{40}$"
        }
      ],
      "description": "Full git commit SHA, populated by GitHub Action after commit"
    }
  },
  "additionalProperties": false,
  "$defs": {
    "SingleMove": {
      "type": "object",
      "required": ["from", "to", "die"],
      "properties": {
        "from": {
          "type": "integer",
          "minimum": -1,
          "maximum": 23,
          "description": "Source: 0-23 for board points, -1 for bar"
        },
        "to": {
          "type": "integer",
          "minimum": 0,
          "maximum": 24,
          "description": "Destination: 0-23 for board points, 24 for bear-off"
        },
        "die": {
          "type": "integer",
          "minimum": 1,
          "maximum": 6,
          "description": "Die value used for this move"
        }
      },
      "additionalProperties": false
    }
  }
}
