{
  "player": "white",
  "moves": [
    { "from": 2, "to": 24, "die": 3 },
    { "from": 2, "to": 24, "die": 3 },
    { "from": 0, "to": 24, "die": 3 },
    { "from": 0, "to": 24, "die": 3 }
  ],
  "timestamp": "2025-01-21T18:20:45Z",
  "expectedState": "0123456789abcdef",
  "diceRoll": [3, 3, 3, 3],
  "comment": "Four off! GG",
  "commitSha": null
}
